name,description,quantity,size,unit,unitPrice,total,GST inc.,grower,category,bulk
Bread Baguette Organic,,,,each,3.64,,0,Leavain Bakery,Bakery,0
Bread Brioche,,,,each,7.7,,0,Leavain Bakery,Bakery,0
Bread Brioche Buns,,,,each,1.68,,0,Leavain Bakery,Bakery,0
Bread Burger Rolls Organic,,,,each,1.26,,0,Leavain Bakery,Bakery,0
Bread Catering Loaf Organic,,,,each,8.78,,0,Leavain Bakery,Bakery,0
Bread Ciabatta Organic,,,,each,5.04,,0,Leavain Bakery,Bakery,0
Bread Demi-Baguette Organic,,,,each,1.68,,0,Leavain Bakery,Bakery,0
Bread Dinner Rolls Organic,,,,each,0.7,,0,Leavain Bakery,Bakery,0
Bread Focaccia Roll Organic,,,,each,1.68,,0,Leavain Bakery,Bakery,0
Bread Middle Eastern Fruit Loaf,,,,each,7.95,,0,Leavain Bakery,Bakery,0
Bread Olive & Rosemary Sourdough Batard Organic,,,,each,5.65,,0,Leavain Bakery,Bakery,0
Bread Pane Organic,,,,each,5.39,,0,Leavain Bakery,Bakery,0
Bread Pannini Organic,,,,each,1.3,,0,Leavain Bakery,Bakery,0
Bread Pasta Dura Organic,,,,each,5.04,,0,Leavain Bakery,Bakery,0
Bread Peasant Loaf Multigrain Organic,,,,each,5.88,,0,Leavain Bakery,Bakery,0
Bread Rye Onion & Caraway Organic,,,,each,6.65,,0,Leavain Bakery,Bakery,0
Bread Rye Sourdough Organic,,,,each,5.88,,0,Leavain Bakery,Bakery,0
Bread Spelt Fig & Pistachio Sourdough Cob Organic,,,,each,6.8,,0,Leavain Bakery,Bakery,0
Bread Spelt Sourdough Batard Organic,,,,each,6.5,,0,Leavain Bakery,Bakery,0
Bread Spelt and Walnut Batard,,,,each,6.7,,0,Leavain Bakery,Bakery,0
Bread Turkish Baps Organic,,,,each,1.26,,0,Leavain Bakery,Bakery,0
Bread Turkish Loaf Organic,,,,each,4.48,,0,Leavain Bakery,Bakery,0
Bread Wheat High Top Organic,,,,each,5.32,,0,Leavain Bakery,Bakery,0
Bread Wheat Sourdough Batard Organic,,,,each,5.18,,0,Leavain Bakery,Bakery,0
Brownie Blueberry Gluten Free,,,,each,3.29,,1,Leavain Bakery,Bakery,0
Brownie Raspberry,,,,each,3.29,,1,Leavain Bakery,Bakery,0
Brownie Spelt and Walnut,,,,each,3.29,,1,Leavain Bakery,Bakery,0
Cake Small Carrot,,,,each,3.29,,1,Leavain Bakery,Bakery,0
Cake Small Gluten Free Flourless Chocolate,,,,each,3.29,,1,Leavain Bakery,Bakery,0
Cake Small Gluten Free Orange Poppy Seed,,,,each,3.29,,1,Leavain Bakery,Bakery,0
Cake Small Gluten Free Pear Polenta,,,,each,3.29,,1,Leavain Bakery,Bakery,0
Cake Small Gluten Free Pistachio Lemon,,,,each,3.29,,1,Leavain Bakery,Bakery,0
Cake Small Gluten Free Raspberry Coconut,,,,each,3.29,,1,Leavain Bakery,Bakery,0
Cookie Chocolate Spelt,,,,each,1.72,,1,Leavain Bakery,Bakery,0
Cookie Shortbread Almond,,,,each,1.72,,1,Leavain Bakery,Bakery,0
Croissant Almond Organic,,,,each,2.88,,1,Leavain Bakery,Bakery,0
Croissant Chocolate Organic,,,,each,2.88,,1,Leavain Bakery,Bakery,0
Croissant Organic,,,,each,2.59,,1,Leavain Bakery,Bakery,0
Danish Blueberry Organic,,,,each,2.88,,1,Leavain Bakery,Bakery,0
Danish Cherry Organic,,,,each,2.88,,1,Leavain Bakery,Bakery,0
Butter Salted Organic 250g,,,,each,4.68,,0,Organic Dairy Farmers of Australia,Chiller,0
Butter Unsalted Biodynamic 200g,,,,each,6.57,,0,Organic Dairy Farmer's of Australia,Chiller,0
Butter Unsalted Organic 250g,,,,each,4.68,,0,Organic Dairy Farmer's of Australia,Chiller,0
Cheese Cheddar Shredded 250g,,,,each,6.75,,0,Barambah Organics,Chiller,0
Cheese Feta Block in Shrink Wrap 250g,,,,each,5.8,,0,Barambah Organics,Chiller,0
Cheese Feta In Brine 200g,,,,each,5.8,,0,Barambah Organics,Chiller,0
Cheese Feta in Marinade 200g,,,,each,6.78,,0,Barambah Organics,Chiller,0
Cheese Fetta in Brine Mungalli Creek Biodynamic 250g,,,,each,7.55,,0,Mungalli Creek,Chiller,0
Cheese Labna w/Fennel & Seasalt 200g,,,,each,6.3,,0,Barambah Organics,Chiller,0
Cheese Parmesan 150g,,,,each,7.15,,0,Organic Dairy Farmer's of Australia,Chiller,0
Cheese Quark 365g,,,,each,5.8,,0,Barambah Organics,Chiller,0
Cheese Quark Mungalli Creek Biodynamic 325g,,,,each,7.1,,0,Mungalli Creek,Chiller,0
Cheese Ricotta Mungalli Creek Biodynamic 325g,,,,each,7.1,,0,Mungalli Creek,Chiller,0
Chocolate Milk Bliss Lactose Free Biodynamic 500ml,,,,each,4.68,,0,Mungalli Creek,Chiller,0
Coffee Cold Pressed Organic 375ml,,,,each,3.86,,1,Barambah Organics,Chiller,0
Coffee Iced Bliss Lactose Free Biodynamic 500ml,,,,each,4.68,,0,Mungalli Creek,Chiller,0
Cottage Cheese 500g,,,,each,6.59,,0,Barambah Organics,Chiller,0
Cream Double Lactose Free Biodynamic 200ml,,,,each,5.46,,0,Mungalli Creek,Chiller,0
Cream Organic 200ml,,,,each,3.89,,0,Barambah Organics,Chiller,0
Cream Pouring Lactose Free Biodynamic 500ml,,,,each,8.71,,0,Mungalli Creek,Chiller,0
Creme Fraiche Lactose Free Biodynamic 200ml,,,,each,5.46,,0,Mungalli Creek,Chiller,0
Ghee Biodynamic 450g,,,,each,19.5,,0,Mungalli Creek,Chiller,0
Juice Apple Cloudy Organic 1L,,,,each,6.24,,0,United Organic Farmers,Chiller,0
Milk Bath Heavenly 2L,,,,each,7.5,,1,Heavenly Bath Milk,Chiller,0
Milk Full Cream 1L,,,,each,2.46,,0,Barambah Organics,Chiller,0
Milk Full Cream 2L,,,,each,4.75,,0,Barambah Organics,Chiller,0
Milk Full Cream Biodynamic 1L,,,,each,4.21,,0,Mungalli Creek,Chiller,0
Milk Full Cream Biodynamic 2L,,,,each,5.9,,0,Mungalli Creek,Chiller,0
Milk Kefir Mungalli Creek Biodynamic 1L,,,,each,5.45,,0,Mungalli Creek,Chiller,0
Milk Lactose Free Biodynamic 1L,,,,each,4.21,,0,Mungalli Creek,Chiller,0
Milk Lactose Free Organic 1L,,,,each,2.46,,0,Barambah Organics,Chiller,0
Milk Lactose Free Organic 2L,,,,each,4.75,,0,Barambah Organics,Chiller,0
Milk Light Organic 1L,,,,each,2.46,,0,Barambah Organics,Chiller,0
Milk Light Organic 2L,,,,each,4.75,,0,Barambah Organics,Chiller,0
Milk Low Fat Biodynamic 1L,,,,each,4.21,,0,Mungalli Creek,Chiller,0
Milk Low Fat Biodynamic 2L,,,,each,5.9,,0,Mungalli Creek,Chiller,0
Milk Low Fat Organic 250ml,,,,each,1.11,,0,Barambah Organics,Chiller,0
Milk Skim Organic 1L,,,,each,2.46,,0,Barambah Organics,Chiller,0
Milk Skim Organic 2L,,,,each,4.75,,0,Barambah Organics,Chiller,0
Smoothie High Protein Banana Organic 375ml,,,,each,3.56,,0,Barambah Organics,Chiller,0
Smoothie High Protein Blueberry Organic 375ml,,,,each,3.56,,0,Barambah Organics,Chiller,0
Smoothie High Protein Mango Organic 375ml,,,,each,3.56,,0,Barambah Organics,Chiller,0
Smoothie High Protein Vanilla Organic 375ml,,,,each,3.56,,0,Barambah Organics,Chiller,0
Sour Cream Organic 200ml,,,,each,4,,0,Barambah Organics,Chiller,0
Tempeh Oriental Organic,,,,each,8.88,,0,Mighty Bean,Chiller,0
Tempeh Plain Organic,,,,each,8.78,,0,Mighty Bean,Chiller,0
Tempeh Savoury Organic,,,,each,8.88,,0,Mighty Bean,Chiller,0
Tofu Cutlets,,,,each,3.5,,0,Pureland,Chiller,0
Tofu Firm Organic 375g,,,,each,4.5,,0,Delisoy,Chiller,0
Tofu Soft Organic 250g,,,,each,3.5,,0,Delisoy,Chiller,0
Yoghurt  Greek Style Berry Bliss Lactose Free Biodynamic 375g,,,,each,4.3,,0,Mungalli Creek,Chiller,0
Yoghurt  Greek Style Mango Tango Lactose Free Biodynamic 375g,,,,each,4.3,,0,Mungalli Creek,Chiller,0
Yoghurt  Greek Style Strawberries and Cream Lactose Free Biodynamic 375g,,,,each,4.3,,0,Mungalli Creek,Chiller,0
Yoghurt  Greek Style Unsweetened Lactose Free Biodynamic 375g,,,,each,4.3,,0,Mungalli Creek,Chiller,0
Yoghurt  Greek Style Unsweetened Lactose Free Biodynamic 750g,,,,each,6.76,,0,Mungalli Creek,Chiller,0
Yoghurt  Greek Style Vanilla and Honey Lactose Free Biodynamic 375g,,,,each,4.3,,0,Mungalli Creek,Chiller,0
Yoghurt All Natural Organic 1kg,,,,each,6.86,,0,Barambah Organics,Chiller,0
Yoghurt All Natural Organic 2kg,,,,each,10.1,,0,Barambah Organics,Chiller,0
Yoghurt All Natural Organic 500g,,,,each,4.13,,0,Barambah Organics,Chiller,0
Yoghurt Blueberry Organic 200g,,,,each,2.34,,0,Barambah Organics,Chiller,0
Yoghurt Blueberry Organic 500g,,,,each,4.37,,0,Barambah Organics,Chiller,0
Yoghurt Bush Honey organic 1kg,,,,each,7.9,,0,Barambah Organics,Chiller,0
Yoghurt Bush Honey organic 200g,,,,each,2.34,,0,Barambah Organics,Chiller,0
Yoghurt Bush Honey organic 500g,,,,each,4.37,,0,Barambah Organics,Chiller,0
Yoghurt Greek Style Sweetened 1kg,,,,each,7.9,,0,Barambah Organics,Chiller,0
Yoghurt Greek Style Sweetened 500g,,,,each,4.26,,0,Barambah Organics,Chiller,0
Yoghurt Heavenly Bath 900g ,,,,each,7.9,,1,Heavenly Bath Milk,Chiller,0
Yoghurt Lactose Free 1kg,,,,each,7.15,,0,Barambah Organics,Chiller,0
Yoghurt Lactose Free 500g,,,,each,4.13,,0,Barambah Organics,Chiller,0
Yoghurt Low Fat Natural 99% Fat Free Organic 1kg,,,,each,7.13,,0,Barambah Organics,Chiller,0
Yoghurt Low Fat Natural 99% Fat Free Organic 500g,,,,each,4.13,,0,Barambah Organics,Chiller,0
Yoghurt Natural Biodynamic 1kg,,,,each,6.31,,0,Mungalli Creek,Chiller,0
Yoghurt Natural Biodynamic 500g,,,,each,4.52,,0,Mungalli Creek,Chiller,0
Yoghurt Natural Davidson Plum Biodynamic 500g,,,,each,4.52,,0,Mungalli Creek,Chiller,0
Yoghurt Natural Honey 500g,,,,each,4.52,,0,Mungalli Creek,Chiller,0
Yoghurt Natural Mango Biodynamic 500g,,,,each,4.52,,0,Mungalli Creek,Chiller,0
Yoghurt Natural Passion Biodynamic 500g,,,,each,4.52,,0,Mungalli Creek,Chiller,0
Yoghurt Real Banana Organic 200g,,,,each,2.34,,0,Barambah Organics,Chiller,0
Yoghurt Real Banana Organic 500g,,,,each,4.37,,0,Barambah Organics,Chiller,0
Yoghurt Real Mango Organic 200g,,,,each,2.34,,0,Barambah Organics,Chiller,0
Yoghurt Real Mango Organic 500g,,,,each,4.37,,0,Barambah Organics,Chiller,0
Yoghurt Real Passionfruit Organic 200g,,,,each,2.34,,0,Barambah Organics,Chiller,0
Yoghurt Real Passionfruit Organic 500g,,,,each,4.5,,0,Barambah Organics,Chiller,0
Yoghurt Real Strawberry Organic 200g,,,,each,2.34,,0,Barambah Organics,Chiller,0
Yoghurt Real Strawberry Organic 500g,,,,each,4.37,,0,Barambah Organics,Chiller,0
Yoghurt Real Vanilla Bean and Cinnamon 200g,,,,each,2.34,,0,Barambah Organics,Chiller,0
Yoghurt Real Vanilla Bean and Cinnamon 500g,,,,each,4.37,,0,Barambah Organics,Chiller,0
Eggs Pastured Dozen 500g,,,,each,5.85,,0,Juanita and Randall Breen,Eggs,0
Eggs Pastured Large Each,,,,each,0.69,,0,Randal and Juanita Breen,Eggs,0
Almond Meal Insecticide Free 200g,,,,each,5.32,,0,Casaretto Family,Flour & Baking,0
Bread Improver Natural 100g,,,,each,2.25,,0,Wholegrain Milling,Flour & Baking,0
Flour Barley Organic 500g,,,,each,3.71,,0,Four Leaf Milling,Flour & Baking,0
Flour Barley Organic 5kg,,,,each,24.71,,0,Four Leaf Milling,Flour & Baking,0
Flour Besan (Chickpea) Organic 750g,,,,each,4.54,,0,Wholegrain Milling,Flour & Baking,0
Flour Emmer White Certified Sustainable 1kg,,,,each,4.94,,0,Wholegrain Milling,Flour & Baking,0
Flour Emmer White Certified Sustainable 5kg,,,,each,20.15,,0,Wholegrain Milling,Flour & Baking,0
Flour Emmer Whole Certified Sustainable 1kg,,,,each,4.68,,0,Wholegrain Milling,Flour & Baking,0
Flour Emmer Whole Certified Sustainable 5kg,,,,each,19.11,,0,Wholegrain Milling,Flour & Baking,0
Flour Khorasan White Organic 1kg,,,,each,5.18,,0,Wholegrain Milling,Flour & Baking,0
Flour Khorasan Whole Organic 1kg,,,,each,5.08,,0,Wholegrain Milling,Flour & Baking,0
Flour Maize Organic 750g,,,,each,5.9,,0,Four Leaf Milling,Flour & Baking,0
Flour Oat Organic 500g,,,,each,4.13,,0,Four Leaf Milling,Flour & Baking,0
Flour Rice Brown Biodynamic 750g,,,,each,5.51,,0,Wholegrain Milling,Flour & Baking,0
Flour Rice White Organic 750g,,,,each,4.62,,0,Wholegrain Milling,Flour & Baking,0
Flour Rye Light Sift Organic 1kg,,,,each,4.4,,0,Wholegrain Milling,Flour & Baking,0
Flour Rye Whole Organic 1kg,,,,each,4.4,,0,Wholegrain Milling,Flour & Baking,0
Flour Spelt Premium White Organic 1kg,,,,each,6,,0,Wholegrain Milling,Flour & Baking,0
Flour Spelt Unbleached White Organic 1kg,,,,each,6,,0,Wholegrain Milling,Flour & Baking,0
Flour Spelt Whole Organic 1kg,,,,each,6.6,,0,Wholegrain Milling,Flour & Baking,0
Flour Wheat Heritage Unbleached White Organic 1kg,,,,each,4.23,,0,Wholegrain Milling,Flour & Baking,0
Flour Wheat Heritage Whole Organic 1kg,,,,each,4.4,,0,Wholegrain Milling,Flour & Baking,0
Flour Wheat Premium Bakers White Organic 1kg,,,,each,4.13,,0,Wholegrain Milling,Flour & Baking,0
Flour Wheat Unbleached White Bakers Organic 1kg,,,,each,4.5,,0,Wholegrain Milling,Flour & Baking,0
Flour Wheat Unbleached White Plain Organic 1kg,,,,each,4.5,,0,Wholegrain Milling,Flour & Baking,0
Flour Wheat Whole Bakers Organic 1kg,,,,each,4.4,,0,Wholegrain Milling,Flour & Baking,0
Pumpkin Seed Meal 500g,,,,each,13.6,,0,Artisan Oil Mill,Flour & Baking,0
Semolina Organic 1kg,,,,each,4.4,,0,Wholegrain Milling,Flour & Baking,0
Sunflower Meal Insecticide Free 500g,,,,each,5.2,,0,,Flour & Baking,0
Apple Granny Smith Organic,,,,kg,8.09,,0,,Fruit & Veg,0
Apple Red Delicious Organic,,,,kg,7.8,,0,,Fruit & Veg,0
Banana Cavendish Organic,,,,kg,5,,0,Ron Bartley Mullumbimby,Fruit & Veg,0
Beans Green Organic,,,,kg,13.65,,0,,Fruit & Veg,0
Beetroot Organic,,,,kg,4.83,,0,,Fruit & Veg,0
Bok Choy Organic,,,,each,3.08,,0,,Fruit & Veg,0
Cabbage Drumhead Organic,,,,each,6.5,,0,,Fruit & Veg,0
Carrots Organic,,,,kg,4.94,,0,,Fruit & Veg,0
Celery Organic,,,,each,6.67,,0,,Fruit & Veg,0
Coriander Organic,,,,each,3.5,,0,,Fruit & Veg,0
Dill Organic,,,,each,3.5,,0,,Fruit & Veg,0
Eschallots Organic,,,,each,3.77,,0,,Fruit & Veg,0
Garlic Red Organic,,,,kg,40,,0,,Fruit & Veg,0
Ginger Organic,,,,kg,35,,0,,Fruit & Veg,0
Lemons Eureka Organic,,,,kg,9,,0,,Fruit & Veg,0
Limes Organic,,,,kg,7.8,,0,,Fruit & Veg,0
Mint Organic,,,,each,3.5,,0,,Fruit & Veg,0
Mushrooms Organic,,,,kg,22.5,,0,,Fruit & Veg,0
Onions Brown Organic,,,,kg,3,,0,,Fruit & Veg,0
Onions Red Organic,,,,kg,4.94,,0,,Fruit & Veg,0
Parsley Flat Organic,,,,each,3.5,,0,,Fruit & Veg,0
Potato Dutch Cream Organic,,,,kg,3.25,,0,,Fruit & Veg,0
Pumpkin Whole Butternut approx 2kg*,,,,adjusted,8,,0,,Fruit & Veg,0
Pumpkin Whole Jap/Kent approx 3kg*,,,,adjusted,8,,0,,Fruit & Veg,0
Rocket Organic,,,,kg,20,,0,,Fruit & Veg,0
Rosemary Organic,,,,each,3.5,,0,,Fruit & Veg,0
Spinach Baby Organic,,,,kg,20,,0,Coolibah Organics,Fruit & Veg,0
Spinach English Bunch Organic,,,,each,3.85,,0,,Fruit & Veg,0
Sunflower shoots Organic,,,,each,5.85,,0,,Fruit & Veg,0
Sweet Potato GOLD Organic,,,,kg,5.54,,0,,Fruit & Veg,0
Tomato Round Organic,,,,kg,8.45,,0,,Fruit & Veg,0
Zucchini Organic,,,,kg,7.54,,0,,Fruit & Veg,0
Dishwasher Powder Lemon myrtle & Lime 2.5 kg,,,,each,18.23,,1,Kin Kin Naturals,Household,0
Dishwashing liquid Lime & Eucalypt 550ml,,,,each,5.48,,1,Kin Kin Naturals,Household,0
Dishwashing liquid Tangerine & Mandarin 550ml,,,,each,5.5,,1,Kin Kin Naturals,Household,0
Laundry Liquid Eucalypt & Lemon Myrtle 1.05 litre,,,,each,10.42,,1,Kin Kin Naturals,Household,0
Laundry Wool and Delicates Wash Eucalyptus Rose and Geranium 550ml,,,,each,6.1,,1,Kin Kin Naturals,Household,0
Soap Organic Honi 70g,,,,each,3.6,,1,ILO Organics,Household,0
Toilet Paper 4pack 400 sheets 2ply Recycled,,,,each,3.15,,0,Queensland Tissue Products,Household,0
Beef Diced Steak approx 500g*,,,,adjusted,10.4,,0,Randal and Juanita Breen,Meat,0
Beef Mince approx 500g*,,,,adjusted,9.75,,0,Randal and Juanita Breen,Meat,0
Beef Sausages approx 500g*,,,,adjusted,9.75,,0,Randal and Juanita Breen,Meat,0
Beef Steak Premium approx 400g*,,,,adjusted,13,,0,Randal and Juanita Breen,Meat,0
Almonds Certified Organic 1kg,,,,each,34.3,,0,Yunis,Nuts & Seeds,0
Almonds Certified Organic 250g,,,,each,9.5,,0,Yunis,Nuts & Seeds,0
Almonds Certified Organic 500g,,,,each,20.15,,0,Yunis,Nuts & Seeds,0
Almonds Price Variety Premium Insecticide Free 500g,,,,each,9.75,,0,Cassaretto Family,Nuts & Seeds,0
Almonds Raw Insecticide Free Retail Pack 200g,,,,each,6.89,,0,Casaretto Family,Nuts & Seeds,0
Almonds Toasted Retail Pack 200g,,,,each,7.74,,1,Cassaretto Family,Nuts & Seeds,0
Hazelnuts Raw Chemical Free 1kg,,,,each,39,,0,Pepo Farms,Nuts & Seeds,0
Hazelnuts Raw Chemical Free 200g,,,,each,9.26,,0,Pepo Farms,Nuts & Seeds,0
Macadamias Honey Roasted Biodynamic 1kg,,,,each,52,,1,Wodonga Park Fruit and Nuts,Nuts & Seeds,0
Macadamias Honey Roasted Biodynamic 200g,,,,each,12.44,,1,Wodonga Park Fruit and Nuts,Nuts & Seeds,0
Macadamias Raw Biodynamic 1kg,,,,each,45,,0,Wodonga Park Fruit and Nuts,Nuts & Seeds,0
Macadamias Raw Biodynamic 200g,,,,each,10.27,,0,Wodonga Park Fruit and Nuts,Nuts & Seeds,0
Macadamias Raw Biodynamic 500g,,,,each,23.4,,0,Wodonga Park Fruit and Nuts,Nuts & Seeds,0
Peanuts Raw Organic 1kg,,,,each,11.44,,0,Evan and Lois Blanch,Nuts & Seeds,0
Peanuts Raw Organic 500g,,,,each,6.18,,0,Evan and Lois Blanch,Nuts & Seeds,0
Peanuts Roasted Organic 1kg,,,,each,12.35,,0,Evan and Lois Blanch,Nuts & Seeds,0
Peanuts Roasted Organic 500g,,,,each,7.28,,0,Evan and Lois Blanch,Nuts & Seeds,0
Pecan Halves Organic 300g,,,,each,11.7,,0,Juction View QLD,Nuts & Seeds,0
Sunflower Kernels Certified Organic 500g,,,,each,8.06,,0,Kialla Pure Foods,Nuts & Seeds,0
Apple Cider Vinegar Organic 500ml,,,,each,5,,0,Bellevue Orchard,Oil & Vinegar,0
Macadamia Oil Biodynamic 250ml,,,,each,10,,0,Wodonga Park Fruit and Nuts,Oil & Vinegar,0
Olive Oil Organic 500ml,,,,each,8.45,,0,Eco Organics,Oil & Vinegar,0
Peanut Oil Organic 250ml,,,,each,5.93,,0,Evan and Lois Blanch,Oil & Vinegar,0
Vinegar Balsamic Merlot 500ml,,,,each,10,,0,Ian Henderson ,Oil & Vinegar,0
Vinegar Balsamic White (Chardonnay) 500ml,,,,each,10,,0,Ian Henderson Ballandean,Oil & Vinegar,0
Vinegar Caramelised Balsamic 250ml,,,,each,12.5,,0,Ian Henderson Ballandean,Oil & Vinegar,0
Vinegar Caramelised Balsamic 500ml,,,,each,19.2,,0,Ian Henderson Ballandean,Oil & Vinegar,0
Vinegar Red Wine 500ml,,,,each,5,,0,Ian Henderson Ballandean,Oil & Vinegar,0
Vinegar White Wine 500ml,,,,each,5.5,,0,Ian Henderson Ballandean,Oil & Vinegar,0
Pump for 20l Detergent Drums (Dispenses 150ml),,,,each,22,,1,,Packaging,0
Pump for 5L Dishwashing Detergent (Dispenses 8ml),,,,each,3.8,,1,,Packaging,0
Pump for 5L Laundry Detergent (Dispenses 30ml),,,,each,11,,1,,Packaging,0
Almond Butter Crunchy Insecticide Free 250g,,,,each,9.75,,0,Casaretto Family,Pantry,0
Almond Butter Insecticide Free 250g,,,,each,9.75,,0,Casaretto Family,Pantry,0
Almond Butter with Chia and Date Insecticide Free 250g,,,,each,9.49,,0,Casaretto Family,Pantry,0
Almond Milk DIY Paste Insecticide Free 250g,,,,each,9.75,,0,Casaretto Family,Pantry,0
Banana Dried Cavendish Organic 1kg,,,,each,19.5,,0,Ron Bartley Mullumbimby,Pantry,0
Banana Dried Cavendish Organic 200g,,,,each,5.6,,0,Ron Bartley Mullumbimby,Pantry,0
Corn Tortillas 8 Pack made from Australian Corn,,,,each,5,,0,,Pantry,0
Figs Dried Organic 1kg,,,,each,59.8,,0,Rosnay Organic,Pantry,0
Figs Dried Organic 200g,,,,each,13,,0,Rosnay Organic,Pantry,0
Mango Dried Organic 1kg,,,,each,54,,0,Ron Bartley,Pantry,0
Mango Dried Organic 200g,,,,each,11.7,,0,Ron Bartley,Pantry,0
Mayonnaise 440g made with Organic Free Range Eggs,,,,each,8.25,,0,Purely Addictive,Pantry,0
Miso Brown Rice (Genmai) 300g,,,,each,13.5,,0,Sunshine Organic Miso,Pantry,0
Miso White Rice Organic (Kome) 300g,,,,each,13.5,,0,Sunshine Organic Miso,Pantry,0
Olives Kalamata Premium Organic 1L,,,,each,14.3,,0,Rosnay Organic,Pantry,0
Olives Kalamata Premium Organic 2.2 litre Pail,,,,each,22.75,,0,Rosnay Organic,Pantry,0
Olives Kalamata Premium Organic 500ml,,,,each,9.1,,0,Rosnay Organic,Pantry,0
Pasta Gluten Free Besan and Buckwheat Penne Organic 375g,,,,each,4.75,,0,L'Abruzzese,Pantry,0
Pasta Gluten Free Besan and Buckwheat Spirals Organic 375g,,,,each,4.75,,0,L'Abruzzese,Pantry,0
Pasta Gluten Free Besan and Buckwheat Tubes Organic 375g,,,,each,4.75,,0,L'Abruzzese,Pantry,0
Pasta Gluten Free Brown Rice and Green Pea Fettuccine 250g,,,,each,3.58,,0,L'Abruzzese,Pantry,0
Pasta Gluten Free Brown Rice and Green Pea Spirals 250g,,,,each,3.58,,0,L'Abruzzese,Pantry,0
Pasta Gluten Free Lentil and Maize Fettuccine Organic 375g,,,,each,4.9,,0,L'Abruzzese,Pantry,0
Pasta Gluten Free Lentil and Maize Penne Organic 375g,,,,each,4.9,,0,L'Abruzzese,Pantry,0
Pasta Gluten Free Lentil and Maize Spaghetti Organic 375g,,,,each,4.9,,0,L'Abruzzese,Pantry,0
Pasta Gluten Free Lentil and Maize Spirals Organic 375g,,,,each,4.9,,0,L'Abruzzese,Pantry,0
Pasta Khorasan (Kamut) Fettuccine Organic 375g,,,,each,4.9,,0,L'Abruzzese,Pantry,0
Pasta Khorasan (Kamut) Penne Organic 375g,,,,each,4.9,,0,L'Abruzzese,Pantry,0
Pasta Khorasan (Kamut) Spaghetti Organic 375g,,,,each,4.9,,0,L'Abruzzese,Pantry,0
Pasta Khorasan (Kamut) Spirals Organic 375g,,,,each,4.9,,0,L'Abruzzese,Pantry,0
Pasta Khorasan (Kamut) Twists Organic 375g,,,,each,4.9,,0,L'Abruzzese,Pantry,0
Pasta Rye Fettuccine Organic 375g,,,,each,3.86,,0,L'Abruzzese,Pantry,0
Pasta Rye Penne Organic 375g,,,,each,3.86,,0,L'Abruzzese,Pantry,0
Pasta Rye Spaghetti Organic 375g,,,,each,3.86,,0,L'Abruzzese,Pantry,0
Pasta Rye Twists Organic 375g,,,,each,3.86,,0,L'Abruzzese,Pantry,0
Pasta Spelt Fettuccine Organic 375g,,,,each,4.9,,0,L'Abruzzese,Pantry,0
Pasta Spelt Lasagne Organic 200g,,,,each,3.12,,0,L'Abruzzese,Pantry,0
Pasta Spelt Linguine Organic 375g,,,,each,4.9,,0,L'Abruzzese,Pantry,0
Pasta Spelt Pappardelle Organic 375g,,,,each,4.9,,0,L'Abruzzese,Pantry,0
Pasta Spelt Penne Organic 375g,,,,each,4.9,,0,L'Abruzzese,Pantry,0
Pasta Spelt Spaghetti Organic 375g,,,,each,4.9,,0,L'Abruzzese,Pantry,0
Pasta Spelt Spirals Organic 375g,,,,each,4.9,,0,L'Abruzzese,Pantry,0
Pasta Wheat Penne Organic 375g,,,,each,3.82,,0,L'Abruzzese,Pantry,0
Pasta Wheat Spirals Organic 375g,,,,each,3.81,,0,L'Abruzzese,Pantry,0
Pasta Wheat Twists Organic 375g,,,,each,3.71,,0,L'Abruzzese,Pantry,0
Pasta Wholemeal Lasagne Organic 300g,,,,each,3.84,,0,L'Abruzzese,Pantry,0
Pasta Wholemeal Penne Organic 375g,,,,each,3.97,,0,L'Abruzzese,Pantry,0
Pasta Wholemeal Spirals Organic 375g,,,,each,3.97,,0,L'Abruzzese,Pantry,0
Pepper Ground Australian Chemical Free 80g,,,,each,4.3,,0,L&L Pepperfarms,Pantry,0
Peppercorns Australian Chemical Free 80g,,,,each,4.3,,0,L&L Pepperfarms,Pantry,0
Preserved Lemon Puree 250ml,,,,each,8.13,,0,Sunshine Organic Miso,Pantry,0
Prunes Organic 250g,,,,each,3,,0,Brookes-Kelly,Pantry,0
Pumpkin Seeds Raw 250g,,,,each,11.5,,0,Australian Pumpkin Seed Company,Pantry,0
Salt Sea Macrobiotic Fine 500g,,,,each,8,,0,Olsson's,Pantry,0
Salt Sea Macrobiotic Rock 500g,,,,each,8,,0,Olsson's,Pantry,0
Salt Sea Macrobiotic Rock with Grinder 150gram,,,,each,6.25,,0,Olsson's,Pantry,0
Salt Sea Rock 1kg,,,,each,1.74,,0,Olsson's,Pantry,0
Salt Sea Table 1kg,,,,each,1.9,,0,Olsson's,Pantry,0
Sugar Brown 2kg,,,,each,4.55,,0,Sunshine Sugar,Pantry,0
Sugar Caster 2kg,,,,each,3.3,,0,Sunshine Sugar,Pantry,0
Sugar Raw 2kg,,,,each,4.11,,0,Sunshine Sugar,Pantry,0
Sugar White 2kg,,,,each,3.3,,0,Sunshine Sugar,Pantry,0
Sultanas Organic 500g,,,,each,7.15,,0,Murray River Organics,Pantry,0
Tamari Soy Sauce Traditional 250ml,,,,each,8.75,,0,Sunshine Miso,Pantry,0
Tea Black Loose Chemical Free 150g,,,,each,4,,0,Nucifora Tea,Pantry,0
Barley Flakes Organic 4kg,,,,each,20.28,,0,Four Leaf Milling,Pulse & Grain,0
Barley Flakes Organic 800g,,,,each,4.78,,0,Four Leaf Milling,Pulse & Grain,0
Barley Pearled Organic 750g,,,,each,4.37,,0,Wholegrain Milling,Pulse & Grain,0
Chia Seeds Chemical Free 500g,,,,each,7.56,,0,Salvetti Family,Pulse & Grain,0
Chickpeas Whole White Organic 750g,,,,each,7.14,,0,Wholegrain Milling,Pulse & Grain,0
Faba Beans Split Biodynamic 750g,,,,each,8,,0,Stephen and Tania Walter,Pulse & Grain,0
Faba Beans Whole Biodynamic 750g,,,,each,7,,0,Stephen and Tania Walter,Pulse & Grain,0
Farro (Pearled Spelt) Biodynamic 750g,,,,each,5.2,,0,Stephen and Tania Walter,Pulse & Grain,0
Lentils French Puy Biodynamic 750g,,,,each,10.4,,0,Stephen and Tania Walter,Pulse & Grain,0
Linseed Brown Organic 500g,,,,each,4.15,,0,Wholegrain Milling,Pulse & Grain,0
Millet Seed (unhulled for Sprouting) Biodynamic 20kg,,,,each,88.96,,0,Four Leaf Milling,Pulse & Grain,0
Millet Seed (unhulled for Sprouting) Biodynamic 5kg,,,,each,24.7,,0,Four Leaf Milling,Pulse & Grain,0
Muesli Glutinous Grain Free 500g,,,,each,7.15,,0,Four Leaf Milling,Pulse & Grain,0
Oat Bran Organic 500g,,,,each,4.06,,0,Four Leaf Milling,Pulse & Grain,0
Oat Kernels Biodynamic 1kg,,,,each,5.98,,0,Four Leaf Milling,Pulse & Grain,0
Oat Meal Organic 500g,,,,each,4.26,,0,Four Leaf Milling,Pulse & Grain,0
Oats Rolled Biodynamic Unstabilised 800g,,,,each,6.11,,0,Stephen and Tania Walter,Pulse & Grain,0
Oats Rolled Organic Stabilised 800g,,,,each,5.85,,0,Four Leaf Milling,Pulse & Grain,0
Oats Rolled Quick Biodynamic Unstabilised 800g,,,,each,5.01,,0,Stephen and Tania Walter,Pulse & Grain,0
Oats Steel Cut Organic 800g,,,,each,6.11,,0,Four Leaf Milling,Pulse & Grain,0
Popping Corn Organic 500g,,,,each,4.34,,0,Four Leaf Milling,Pulse & Grain,0
Quinoa Organic 500g,,,,each,7.15,,0,Damen Family Kindred,Pulse & Grain,0
Rice Brown Medium Grain Biodynamic 1kg,,,,each,6.89,,0,Biodynamic Marketing,Pulse & Grain,0
Rice White Medium Grain Organic 1kg,,,,each,6.76,,0,Rice Growers Limited,Pulse & Grain,0
Rye Grain Organic 1kg,,,,each,5.2,,0,Four Leaf Milling,Pulse & Grain,0
Soya Beans Biodynamic 1kg,,,,each,4.9,,0,Slater Farms,Pulse & Grain,0
Wheat Sprouting Biodynamic 1kg,,,,each,4.29,,0,Four Leaf Milling,Pulse & Grain,0
Yellow Split Peas Biodynamic 750g,,,,each,4.82,,0,Four Leaf Milling,Pulse & Grain,0
Cheese Cheddar Wheel approx 8.3kg*,,,,adjusted,170,,0,Barambah Organics,Chiller,1
Cheese Feta in Brine 1.6kg,,,,each,35.06,,0,Barambah Organics,Chiller,1
Cheese Feta in Marinade 1.6kg,,,,each,50.9,,0,Barambah Organics,Chiller,1
Cheese Fetta in Brine Biodynamic 6kg,,,,each,114.66,,0,Mungalli Creek,Chiller,1
Cheese Labna 1.6kg,,,,each,43.93,,0,Barambah Organics,Chiller,1
Cheese Quark 2kg,,,,each,34.31,,0,Barambah Organics,Chiller,1
Yoghurt All Natural 10 litre,,,,each,48.76,,0,Barambah Organics,Chiller,1
Eggs Pastured Large Catering 180 pack,,,,each,120,,0,Randal and Juanita Breen,Eggs,1
Flour Besan (Chickpea) Organic 25kg,,,,each,88.4,,0,Wholegrain Milling,Flour & Baking,1
Flour Besan (Chickpea) Organic 5kg,,,,each,21.33,,0,Wholegrain Milling,Flour & Baking,1
Flour Khorasan White Organic 25kg,,,,each,75.27,,0,Wholegrain Milling,Flour & Baking,1
Flour Khorasan White Organic 5kg,,,,each,16.25,,0,Wholegrain Milling,Flour & Baking,1
